1447,Lastrapes 2018,2018,Published study,Single-case design- MBL,1 United States,4 Suburban,2010,1 general education teacher,5,2 no,0,100,0,100,0,0,0,0,0,0,0,0,39,12,,General education,,15,,No,No primary,Learning disability; Emotional-behavioral disorder; Attention deficit hyperactivity disorder,"1 Not formally identified e.g. ""at-risk"" or ""struggling""; 2 Formally identified- IEP or diagnosis",1 Elementary (K-5),ELA; Math; Science; Social Studies,,,10,,"positive statements that did not mention a specific behavior, such as ""good job""",Not reported,corrective statements,"vocal reprimands that expressed disapproval of a student or class a s whole, ""you're being rude""",Not reported,,,,,,,,,,,,,,,,,,,,,,Behavioral feedback,1 whole group ; 3 individual students (not pre-determined),11,10,Not reported,3 Coding from audio recording,1 Continuous,1 Event Sampling (Frequency),1 researcher developed coding system,,1 Yes,1 teachers; 2 students,Teacher vs Student game,1 yes,1 engagement/on-task behavior,2,2,0,2,2,2,10,8
1450,Cooper 2018,2018,Published study,Single-case design- ABAB,1 United States,3 Rural,2010,1 general education teacher,1,2 no,0,100,0,100,0,0,0,0,0,0,0,0,,5,,General education,25,1,25,No,Emotional-behavioral disorder,Emotional-behavioral disorder; Attention deficit hyperactivity disorder,2 Formally identified- IEP or diagnosis,1 Elementary (K-5),Math,,,37,,,,,,,,,,,,,,,,,,,,,,,,,,,,Questioning,2 target students (pre-determined),6,15,Not reported,1 Live observation and coding,1 Continuous,1 Event Sampling (Frequency),1 researcher developed coding system,,1 Yes,1 teachers,increasing frequency of OTR,1 yes,1 engagement/on-task behavior,2,2,1,2,2,0,9,7
1451,Kranak 2017,2017,Published study,Single-case design- Other,1 United States,5 Not reported,2010,2 special education teacher,1,2 no,0,100,0,0,0,0,0,0,0,0,0,100,29,1,,Alternative/Specialized,5,5,5,No,Autism spectrum disorder,Autism spectrum disorder,2 Formally identified- IEP or diagnosis,1 Elementary (K-5),Reading; Math,,,1,,,,,,,,,,,,,,,,,,,,,,,,,,,,Behavioral feedback,1 whole group ; 3 individual students (not pre-determined),3,20,Not reported,1 Live observation and coding,1 Continuous,1 Event Sampling (Frequency),1 researcher developed coding system,,1 Yes,2 students,manipulating praise rates to see if that changed on-task behavior,1 yes,1 engagement/on-task behavior,0,2,1,2,2,1,8,8
1463,Duchaine 2011,2011,Published study,Single-case design- MBL,1 United States,4 Suburban,2010,1 general education teacher; 2 special education teacher,3,2 no,33,66,0,33,33,33,0,0,0,0,0,0,,4,,Inclusion,62,16,20,No,No primary,Learning disability; Emotional-behavioral disorder; Other Health Impairment,2 Formally identified- IEP or diagnosis,3 High (9-12),Math,,,1,,,,,,,,,,,,,,,,,,,,,,,,,,,,Behavioral feedback,1 whole group ; 2 target students (pre-determined),8,15,Not reported,1 Live observation and coding,1 Continuous,1 Event Sampling (Frequency),1 researcher developed coding system,,1 Yes,1 teachers,increasing BSPS through written performance feedback,1 yes,1 engagement/on-task behavior,2,1,1,2,2,2,10,8
1516,Orr 2020,2020,Published study,Single-case design- ABAB,1 United States,4 Suburban,2020,2 special education teacher,1,2 no,0,100,0,100,0,0,0,0,0,0,0,0,28,8,,Special education,23,12,20,No,No primary,Learning disability; Intellectual developmental disability; Developmental language disorder; Autism spectrum disorder; Other Health Impairment,2 Formally identified- IEP or diagnosis,2 Middle (6-8); 3 High (9-12),Other,,,33,,punitive statement or suggestion of displeasure in behavior,.31/min,,,,,,,,,,,,,,,,,,,,,,,,,Behavioral feedback,1 whole group ; 3 individual students (not pre-determined),5,20,Not reported,1 Live observation and coding,1 Continuous,1 Event Sampling (Frequency),1 researcher developed coding system,,1 Yes,1 teachers; 2 students,CW-FIT,1 yes,1 engagement/on-task behavior,2,2,2,2,2,1,11,9
1528,Downs 2019,2019,Published study,Correlational,1 United States,5 Not reported,2010,1 general education teacher; 2 special education teacher,65,2 no,3,97,0,86,0,0,0,0,0,0,0,14,,10,,General education; Special education,,130,,No,Emotional-behavioral disorder,Learning disability; Intellectual developmental disability; Developmental language disorder; Emotional-behavioral disorder; Autism spectrum disorder,"1 Not formally identified e.g. ""at-risk"" or ""struggling""; 2 Formally identified- IEP or diagnosis",1 Elementary (K-5),ELA; Reading; Writing; Math; Science; Social Studies; Not reported,,,0,,verbal statements  to individuals or groups indicating disapproval of inappropriate behavior or desire that a specific behavior be stopped,0.07/min (avg of rate),,,,,,,,,,,,,,,,,,,,,,,,,Behavioral feedback,1 whole group ; 2 target students (pre-determined),,14,4-6 months,1 Live observation and coding,1 Continuous,1 Event Sampling (Frequency),1 researcher developed coding system,,2 No,3 NA,,1 yes,1 engagement/on-task behavior,2,1,1,2,2,1,9,7
1530,Owens 2018,2018,Published study,Correlational,1 United States,5 Not reported,2010,1 general education teacher,55,2 no,5,94,0,49,0,47,0,0,0,0,0,3,,14,,General education,,55,,No,Attention deficit hyperactivity disorder,Attention deficit hyperactivity disorder,"1 Not formally identified e.g. ""at-risk"" or ""struggling""; 2 Formally identified- IEP or diagnosis",1 Elementary (K-5),Not reported,,,5,,Not reported,.01min,total effective commands,Not reported,.76/min,total ineffective commands,Not reported,.15/min,,,,,,,,,,,,,,,,,,,Undefined,1 whole group ; 2 target students (pre-determined),4,29,Not reported,1 Live observation and coding,1 Continuous,1 Event Sampling (Frequency),2 existing coding system (e.g. Brophy-Good Dyadic Interaction),"Student Behavior-Teacher Response (SBTR; Pelham, Greiner, & Gnagy, 2008)",2 No,3 NA,,1 yes,2 challenging/disruptive behavior,2,2,1,0,2,0,7,5
1554,Allday 2012,2012,Published study,Single-case design- MBL,1 United States,5 Not reported,2010,1 general education teacher,3,1 yes,0,100,0,100,0,0,0,0,0,0,0,0,,,,General education,59,5,19,Yes,Emotional-behavioral disorder,Emotional-behavioral disorder,"1 Not formally identified e.g. ""at-risk"" or ""struggling""; 2 Formally identified- IEP or diagnosis",1 Elementary (K-5),Not reported,,,27,,Audible statement that conveys general reference to a desirable behavior.,.34/min,Behavior-Specific Correction,Audible statement that conveys explicit reference to an undesirable behavior.,Not reported,Generic Correction,Audible statement that conveys general reference to undesirable behavior.,Not reported,Target Student Praise,Audible statement that uses a target student's name that conveys desirable behavior.,.03/min,Target Student Correction,Audible statement that uses a target student's name that conveys undesirable behavior.,.10/min,Overall Correction,Generic Correction and Behavior-Specific Correction combined,1.00/min,,,,,,,,,,Behavioral feedback,1 whole group ; 2 target students (pre-determined),7,27,Not reported,3 Coding from audio recording,1 Continuous,1 Event Sampling (Frequency),1 researcher developed coding system,,1 Yes,1 teachers,behavior-specific praise,1 yes,1 engagement/on-task behavior,2,2,1,2,2,1,10,8
1617,Monson 2020,2020,Published study,Single-case design- ABAB,1 United States,5 Not reported,2020,1 general education teacher,2,2 no,50,50,0,0,0,0,0,0,0,0,0,100,36,5,,General education,56,2,28,No,Emotional-behavioral disorder,Emotional-behavioral disorder,"1 Not formally identified e.g. ""at-risk"" or ""struggling""",2 Middle (6-8),Other,,,1,,verbal statements in which the teacher told individuals or groups to stop an undesired behavior,0.26/min,,,,,,,,,,,,,,,,,,,,,,,,,Behavioral feedback,1 whole group ; 3 individual students (not pre-determined),5,20,Not reported,1 Live observation and coding,1 Continuous,1 Event Sampling (Frequency),1 researcher developed coding system,,1 Yes,1 teachers; 2 students,CW-FIT,1 yes,1 engagement/on-task behavior,0,2,2,2,2,2,10,10
1732,Lastrapes 2019,2019,Published study,Single-case design- MBL,1 United States,4 Suburban,2010,2 special education teacher,2,2 no,0,100,0,0,0,0,0,0,0,0,0,100,,9,,Resource room,13,4,6,No,Emotional-behavioral disorder,Emotional-behavioral disorder,"1 Not formally identified e.g. ""at-risk"" or ""struggling""; 2 Formally identified- IEP or diagnosis",2 Middle (6-8),Academics,,,0,,praise statements in response to student behavior but without a specific comment as to why the praise was being offered,0.04/min avg of rates,corrective statements,criticism of a certain behavior or verbal expression of disapproval by the teacher to a student(s) or class as a whole,0.16/min avg of rates,,,,,,,,,,,,,,,,,,,,,,Behavioral feedback,1 whole group ; 3 individual students (not pre-determined),22,11,A Semester,1 Live observation and coding,1 Continuous,1 Event Sampling (Frequency),1 researcher developed coding system,,1 Yes,1 teachers; 2 students,Teacher vs. Student game,2 no,8 NA,0,2,0,2,2,2,8,8
1790,Sutherland 2001,2001,Published study,Randomized controlled trial,1 United States,5 Not reported,2000,2 special education teacher,20,2 no,15,85,0,55,45,0,0,0,0,0,0,0,39,12,,Special education,216,216,10,No,Emotional-behavioral disorder,Learning disability; Intellectual developmental disability; Emotional-behavioral disorder,2 Formally identified- IEP or diagnosis,1 Elementary (K-5); 2 Middle (6-8),Academics,,,0,,Verbal comments indicating disapproval of students’ academic or social behavior,0.40/min,academic talk,"Verbal statement by the teacher that pertains to the lesson at hand; may
clarify or explain concept being taught or be examples of concepts being
taught; may also be acknowledgment that is not praise",3.97/min,Other,All other verbal behaviors performed by the teacher,2.27/min,,,,,,,,,,,,,,,,,,,Academic feedback ; Behavioral feedback ; Instructional; Teacher talk,1 whole group ; 3 individual students (not pre-determined),,15,Not reported,1 Live observation and coding,1 Continuous,1 Event Sampling (Frequency),1 researcher developed coding system,,1 Yes,1 teachers,self-evaluation to improve praise rates and decrease reprimands,1 yes,7 other academic,2,2,2,2,2,0,10,8
1825,Randolph 2021,2021,Published study,Single-case design- MBL,1 United States,3 Rural,2020,2 special education teacher; 3 paraprofessional/paraeducator/aide,3,2 no,33,66,0,100,0,0,0,0,0,0,0,0,33,,,Alternative/Specialized,,4,,No,Emotional-behavioral disorder,Emotional-behavioral disorder,2 Formally identified- IEP or diagnosis,1 Elementary (K-5),Not reported,,,0,,,,,,,,,,,,,,,,,,,,,,,,,,,,Behavioral feedback,3 individual students (not pre-determined),5,13,Not reported,Other,1 Continuous,1 Event Sampling (Frequency),1 researcher developed coding system,,1 Yes,1 teachers,PD and Icoaching in using BSP,2 no,8 NA,2,2,2,2,2,2,12,10
1833,Speight 2020,2020,Published study,Single-case design- MBL,1 United States,5 Not reported,2020,1 general education teacher,2,1 yes,0,100,0,50,50,0,0,0,0,0,0,0,,2,SPED co-teachers were not included in the language measurement so any language they provided is absent from the analysis,Inclusion,19,8,9,Yes,No primary,Learning disability; Autism spectrum disorder; Attention deficit hyperactivity disorder,2 Formally identified- IEP or diagnosis,2 Middle (6-8),ELA,,,1,,Not reported but examples given,10.69 avg freq,,,,,,,,,,,,,,,,,,,,,,,,,Behavioral feedback,1 whole group ; 3 individual students (not pre-determined),11,,Not reported,1 Live observation and coding,1 Continuous,1 Event Sampling (Frequency),1 researcher developed coding system,,1 Yes,1 teachers; 2 students,CW-FIT,1 yes,1 engagement/on-task behavior,2,2,2,1,2,1,10,8
1856,Hawkins 2011,2011,Published study,Single-case design- Other,1 United States,5 Not reported,2010,2 special education teacher,3,2 no,33,66,0,0,0,0,0,0,0,0,0,100,29,4,,Alternative/Specialized,27,27,9,No,Emotional-behavioral disorder,Emotional-behavioral disorder,2 Formally identified- IEP or diagnosis,3 High (9-12),Academics,,,6,,"verbal praise 
given by the teacher that did not specify the desired behavior for which the student was being praised",0.09/min (avg of rates),reprimands,criticism or a verbal expression of disapproval by the teacher addressed to a student.,0.05/min (avg of rates),,,,,,,,,,,,,,,,,,,,,,Behavioral feedback,1 whole group ; 3 individual students (not pre-determined),10,10,Not reported,2 Coding from video recording,1 Continuous,1 Event Sampling (Frequency),1 researcher developed coding system,,1 Yes,1 teachers,video self monitoring & visual performance feedback to increase praise,2 no,8 NA,0,2,2,2,2,1,9,9
1929,Gage 2017,2017,Published study,Single-case design- MBL,1 United States,5 Not reported,2010,1 general education teacher,3,2 no,0,100,0,100,0,0,0,0,0,0,0,0,,2,,General education,,3,,No,Emotional-behavioral disorder,Emotional-behavioral disorder,"1 Not formally identified e.g. ""at-risk"" or ""struggling""",1 Elementary (K-5),Reading; Math,,,0,,,,,,,,,,,,,,,,,,,,,,,,,,,,Behavioral feedback,1 whole group ; 2 target students (pre-determined),9,15,Not reported,1 Live observation and coding,1 Continuous,1 Event Sampling (Frequency),1 researcher developed coding system,,1 Yes,1 teachers,"Reviewing BSP definitions and guidance for increasing BSP, data from baseline observations, and a set goal of 6 BSP statements during reading instruction.",1 yes,1 engagement/on-task behavior; 2 challenging/disruptive behavior,2,2,1,2,2,2,11,9
2006,Caldarella 2023,2023,Published study,Randomized controlled trial,1 United States,2 Urban (low-income/SES); Other: interurban,2020,1 general education teacher,28,2 no,28,71,0,89,0,0,0,0,0,0,0,10,35,7,,General education,628,75,23,No,Emotional-behavioral disorder,Emotional-behavioral disorder,"1 Not formally identified e.g. ""at-risk"" or ""struggling""",2 Middle (6-8),ELA; Reading; Math; Science; Social Studies,,,0,,"a verbal comment intended to stop 
misbehavior.",7.46,,,,,,,,,,,,,,,,,,,,,,,,,Behavioral feedback,1 whole group,3,20,2 weeks,1 Live observation and coding,1 Continuous,1 Event Sampling (Frequency),1 researcher developed coding system,,1 Yes,1 teachers; 2 students,praise to reprimand ratios and student behavior,1 yes,1 engagement/on-task behavior; 2 challenging/disruptive behavior; 4 reading; 5 math; 7 other academic,2,2,1,2,2,2,11,9
2009,Sabey 2021,2021,Published study,Single-case design- ABAB,1 United States,4 Suburban,2020,2 special education teacher,1,2 no,100,0,0,100,0,0,0,0,0,0,0,0,53,,,Special education,8,8,8,No,Emotional-behavioral disorder,Emotional-behavioral disorder,2 Formally identified- IEP or diagnosis,1 Elementary (K-5),Social Studies,,,1,,any teacher statement of affirmation to a student or group of students,.62/min,,,,,,,,,,,,,,,,,,,,,,,,,Behavioral feedback,1 whole group ; 3 individual students (not pre-determined),6,15,Not reported,Other,1 Continuous,1 Event Sampling (Frequency),1 researcher developed coding system,,1 Yes,1 teachers,use of precision requests,1 yes,1 engagement/on-task behavior; 2 challenging/disruptive behavior,2,2,0,2,2,1,9,7
2020,Carmouche 2018,2018,Published study,Single-case design- MBL,1 United States,1 Urban,2010,2 special education teacher,3,2 no,66,33,0,0,0,0,0,0,0,0,0,100,,4,,Special education,,6,,No,Emotional-behavioral disorder,Emotional-behavioral disorder,2 Formally identified- IEP or diagnosis,2 Middle (6-8),ELA,,,0,,,,,,,,,,,,,,,,,,,,,,,,,,,,Questioning,1 whole group,9,15,Not reported,Other,1 Continuous,1 Event Sampling (Frequency),1 researcher developed coding system,,1 Yes,1 teachers,Professional development and teacher coaching on teacher's OTRs,1 yes,1 engagement/on-task behavior,0,2,2,2,2,2,10,10
2128,Whitney 2017,2017,Published study,Single-case design- MBL,1 United States,5 Not reported,2010,1 general education teacher,1,2 no,0,100,0,100,0,0,0,0,0,0,0,0,,8,,Small group,4,4,4,No,No primary,Math disability; Emotional-behavioral disorder,"1 Not formally identified e.g. ""at-risk"" or ""struggling""; 2 Formally identified- IEP or diagnosis",1 Elementary (K-5),Math,,,0,,,,,,,,,,,,,,,,,,,,,,,,,,,,Questioning,1 whole group ; 3 individual students (not pre-determined),29,10,Not reported,1 Live observation and coding,1 Continuous,1 Event Sampling (Frequency),1 researcher developed coding system,,1 Yes,2 students,using children's literature in math instruction,1 yes,1 engagement/on-task behavior; 2 challenging/disruptive behavior,2,2,2,2,2,2,12,10
2214,Randolph 2020,2020,Published study,Single-case design- Other,1 United States,5 Not reported,2020,2 special education teacher,4,2 no,25,75,0,50,25,25,0,0,0,0,0,0,34,7,,Alternative/Specialized,39,39,9,No,Autism spectrum disorder,Autism spectrum disorder,2 Formally identified- IEP or diagnosis,1 Elementary (K-5); 2 Middle (6-8),Not reported,,,,,prompt is directed toward an academic task,Not reported,OTR-nonacademic,prompt is directed toward a nonacademic task,Not reported,Individual Student OTR,Prompt is directed to individual student,Not reported,Class OTR,Prompt is directed to entire  class,Not reported,,,,,,,,,,,,,,,,Questioning,1 whole group ; 3 individual students (not pre-determined),6,,Not reported,Other,1 Continuous,3 Interval,1 researcher developed coding system,,1 Yes,1 teachers,iCoaching for increased OTR,1 yes,1 engagement/on-task behavior; 7 other academic,2,2,2,2,2,1,11,9
2250,Dukmak 2010,2010,Published study,Descriptive,7 United Arab Emirates,5 Not reported,2010,2 special education teacher,2,1 yes,0,100,0,0,0,0,0,0,0,0,0,100,,,,Special education,16,6,8,Yes,No primary,Reading disability; Emotional-behavioral disorder,2 Formally identified- IEP or diagnosis,1 Elementary (K-5),ELA; Math; Science; Other,,,29,,When the teacher asks a student to do anything related to classroom work,33 avg of freq,,,,,,,,,,,,,,,,,,,,,,,,,Questioning; Logistical,2 target students (pre-determined),16,45,4 days,1 Live observation and coding,1 Continuous,1 Event Sampling (Frequency),1 researcher developed coding system,,2 No,3 NA,,2 no,8 NA,0,2,1,2,2,1,8,8
2952,Sprague 2009,2009,Published study,Single-case design- MBL,1 United States,5 Not reported,2000,1 general education teacher,3,1 yes,0,100,0,100,0,0,0,0,0,0,0,0,,4,,General education,,9,,Yes,Emotional-behavioral disorder,Emotional-behavioral disorder,"1 Not formally identified e.g. ""at-risk"" or ""struggling""; 2 Formally identified- IEP or diagnosis",1 Elementary (K-5),Other,,,0,,,,,,,,,,,,,,,,,,,,,,,,,,,,Behavioral feedback,2 target students (pre-determined),13,15,Not reported,1 Live observation and coding,2 Intermittent,1 Event Sampling (Frequency),1 researcher developed coding system,,1 Yes,2 students,First Step to Success program,1 yes,1 engagement/on-task behavior; 2 challenging/disruptive behavior,2,2,0,1,2,2,9,7
3212,Levine 1999,1999,Dissertation,Ethnographic,1 United States,5 Not reported,1990,2 special education teacher,1,2 no,100,0,0,0,0,0,0,0,0,0,0,100,,14,,Special education,8,8,8,No,Learning disability,Learning disability; Intellectual developmental disability; Emotional-behavioral disorder,"1 Not formally identified e.g. ""at-risk"" or ""struggling""; 2 Formally identified- IEP or diagnosis",3 High (9-12),Writing; Social Studies,,,45,,"comments related to
the management of the class, including questions about
directions, seating arrangements, distribution of class
materials, scheduling, report cards, and transportation
passes.",2.50%,personal comments,"related to individual concerns not
connected to school, such as how someone was feeling or
looked",0.60%,academic discourse,"included questions about academic information, tasks and personal opinions about what was
being discussed",51.20%,,,,,,,,,,,,,,,,,,,Dialogic teaching; Behavioral feedback ; Questioning; Logistical; Teacher talk,1 whole group ; 3 individual students (not pre-determined),10,38,5 weeks,4 Coded from human transcription of audio/video,1 Continuous,1 Event Sampling (Frequency),1 researcher developed coding system,,2 No,3 NA,,2 no,8 NA,0,1,2,2,2,1,8,8
3220,Rowe 1996,1996,Dissertation,Qualitative,1 United States,5 Not reported,1990,2 special education teacher,1,2 no,0,100,0,0,100,0,0,0,0,0,0,0,,25,,Special education,19,19,9,No,Learning disability,Learning disability,2 Formally identified- IEP or diagnosis,2 Middle (6-8),Math; Social Studies,,,4,,Not reported,7,"""assess"" student answers",Not reported,80.5,asks factual questions,Not reported,185,emphasizes student ideas,Not reported,12.5,replies to student answers,Not reported,20,,Not reported,,,Not reported,,,,,,,,Questioning; Undefined,,5,45,6 weeks,4 Coded from human transcription of audio/video,1 Continuous,1 Event Sampling (Frequency),1 researcher developed coding system,,1 Yes,1 teachers,transmissional teaching practices,1 yes,1 engagement/on-task behavior; 6 oral language,2,1,0,0,0,0,3,1
3378,Jones 2012,2012,Dissertation,Qualitative,1 United States,1 Urban,2010,1 general education teacher,5,2 no,0,100,0,0,0,0,0,0,0,0,0,100,,6,,Small group,21,11,4,No,Learning disability,Learning disability,2 Formally identified- IEP or diagnosis,1 Elementary (K-5),Reading,,,1,,"prompts, models/explanations, accepted approximations, rephrased/restated questions, processing time, corrected answers",1.58/min,,,,,,,,,,,,,,,,,,,,,,,,,Explicit instruction; Academic feedback ; Questioning,1 whole group ; 3 individual students (not pre-determined),2,21,10 weeks,4 Coded from human transcription of audio/video,1 Continuous,1 Event Sampling (Frequency),3 adapted from existing coding system,Frey and Fisher (2010),2 No,3 NA,,1 yes,4 reading,0,2,2,2,2,0,8,8
3388,Rodriguez 2010,2010,Dissertation,Single-case design- MBL,1 United States,5 Not reported,2010,3 paraprofessional/paraeducator/aide,5,2 no,0,100,0,0,0,0,0,0,0,0,0,100,,10,,Small group,22,22,4,No,Reading disability,Reading disability,"1 Not formally identified e.g. ""at-risk"" or ""struggling""",1 Elementary (K-5),Reading,,,3,,,,,,,,,,,,,,,,,,,,,,,,,,,,Questioning,1 whole group ; 3 individual students (not pre-determined),12,12,Not reported,1 Live observation and coding,1 Continuous,1 Event Sampling (Frequency),1 researcher developed coding system,,1 Yes,1 teachers; 2 students,Using the Good Behavior Game to impact student and teacher behavior,1 yes,1 engagement/on-task behavior; 2 challenging/disruptive behavior; 4 reading,0,2,2,2,2,1,9,9
3420,Hall 1991,1991,Unpublished/Conference Paper,Ethnographic,1 United States,1 Urban,1990,1 general education teacher; 2 special education teacher,,2 no,0,0,100,0,0,0,0,0,0,0,0,100,,,,General education; Resource room,,5,,No,Learning disability,Learning disability,2 Formally identified- IEP or diagnosis,1 Elementary (K-5),Reading,,,6,,"The prompt continuum ranged from low to high
complexity: ""simplifies request:"" ""direct prompt, question
or command:"" ""indirect prompt, question:"" and ""indirect
statement, implying that some action be taken on the part
of the hearer.""",Not reported,initiation,percentage of student-teacher interactions that were teacher initiated,87.31% of interactions,,,,,,,,,,,,,,,,,,,,,,Dialogic teaching; Explicit instruction,1 whole group ; 2 target students (pre-determined),5,60,6-9 months,4 Coded from human transcription of audio/video,1 Continuous,1 Event Sampling (Frequency),3 adapted from existing coding system,Coding Scheme for Special Education and Mainstream Settings based on Levine (n.d.),2 No,3 NA,,1 yes,1 engagement/on-task behavior; 4 reading,0,1,1,1,0,0,3,3
3483,Boardman 2005,2004,Dissertation,Qualitative,1 United States,1 Urban,2000,1 general education teacher,4,2 no,0,100,0,0,0,0,0,0,0,0,0,100,,14,,General education,108,17,27,No,Reading disability,Learning disability,"1 Not formally identified e.g. ""at-risk"" or ""struggling""; 2 Formally identified- IEP or diagnosis",1 Elementary (K-5),ELA; Science; Social Studies,,,4,,"involved the teacher attending to student behavior, most 
often by redirecting the student back to the task.",.02/min,procedural contacts,"involved bringing the student to 
the task but did not yet involve any work-related talk.",.01/min,non-work-related contacts,"Interactions that were not related to the lesson of the day were termed non-
work related (NWR)",.01/min,,,,,,,,,,,,,,,,,,,Behavioral feedback ; Instructional; Logistical,2 target students (pre-determined),8,46,Not reported,4 Coded from human transcription of audio/video,1 Continuous,1 Event Sampling (Frequency),3 adapted from existing coding system,Brophy-Good Dyadic Interaction System,2 No,3 NA,,2 no,8 NA,0,1,1,2,0,0,4,4
3503,Gibbons 1996,1996,Dissertation,Descriptive,1 United States,3 Rural; 4 Suburban,1990,1 general education teacher,19,2 no,0,0,100,0,0,0,0,0,0,0,0,100,,,,General education,,22,,No,Attention deficit hyperactivity disorder,Attention deficit hyperactivity disorder,2 Formally identified- IEP or diagnosis,1 Elementary (K-5),Reading,,,5,,"the teacher is providing TS with information or feedback regarding accuracy of his or her verbal, written, or motoric response to a content-related task",.59%(avg of % of intervals)intervals),,,,,,,,,,,,,,,,,,,,,,,,,Academic feedback ; Questioning,2 target students (pre-determined),20,20,10 weeks,1 Live observation and coding,2 Intermittent,3 Interval,2 existing coding system (e.g. Brophy-Good Dyadic Interaction),Classroom Activity Recording Form (CARF),2 No,3 NA,,1 yes,4 reading,0,2,2,1,0,0,5,5
