3516,Vespe 1987,1986,Dissertation,Descriptive,1 United States,4 Suburban,1980,1 general education teacher,3,2 no,0,0,100,0,0,0,0,0,0,0,0,100,,,,General education,65,11,21,No,Learning disability,Learning disability,2 Formally identified- IEP or diagnosis,1 Elementary (K-5); 2 Middle (6-8),Academics,,,18,,"Includes only questions with predetermined
correct answers. Teacher always has the
answer before asking the question.",12.77%,integrative- questions regarding pupil,"Questions regarding the pupil's expressed
interest or activity which do not contribute
to a problem of the pupil's (IT-12), or which
do not merely express approva",0.30%,integrative- statement regarding pupil,"Statements regarding the pupil's expressed
interest or activity which do not contribute
to a problem of the pupil, or which do not
merely express approval.",0.48%,integrative- admits responsibility,"Admits responsibility for own act that is
inconvenient, unjust, or unfair to another,
or admits own error or incapacity",0.30%,integrative- question,"Regarding possible, thought: no expressed,
interest or activity of child. Teacher is
asking for information.",3.22%,integrative- statement,"Regarding possible, though not expressed,
interest or activity of pupil",1.55%,,,,,,,,,,Questioning; Instructional; SEL,1 whole group ; 2 target students (pre-determined),3,240,1 month,1 Live observation and coding,1 Continuous,1 Event Sampling (Frequency),2 existing coding system (e.g. Brophy-Good Dyadic Interaction),"Revised Method for Recording Teachers' Dominative and Integrative Contacts (Anderson & Brewer, 1946)",2 No,3 NA,,2 no,8 NA,0,2,2,1,2,0,7,7
3529,GAUTHIER 1980,1980,Dissertation,Descriptive,1 United States,3 Rural; 4 Suburban,1980,1 general education teacher,4,2 no,100,0,0,0,0,0,0,0,0,0,0,100,,5,,Inclusion,106,14,26,No,Learning disability,Learning disability,2 Formally identified- IEP or diagnosis,1 Elementary (K-5),PE,,,,,a positive response by the teacher to a skill or movement attempt by the student. This feedback is positive and is stated in specific terms which relate to the student what about the effort was good.,Not reported,corrective skill feedback,a response by the teacher to a skill or movement attempt by the student. This feedback is given in response to a performance error,Not reported,negative skill feedback- general,"a negative response by the teacher to an incorrectly executed skill or movement attempt by the student. This indicates only that the attempt was incorrect, but does not express what about the skill was wrong",Not reported,negative skill feedback- specific,a negative response by the teacher to an incorrectly executed skill or movement attempt by the student. The negative includes information which indicates what about the skill was wrong.,Not reported,,,,,,,,,,,,,,,,Academic feedback,1 whole group ; 2 target students (pre-determined),4,,Not reported,2 Coding from video recording,1 Continuous,3 Interval,2 existing coding system (e.g. Brophy-Good Dyadic Interaction),Observational System for Instructional Analysis - Physical Education (OSIA-PE),2 No,3 NA,,1 yes,1 engagement/on-task behavior,0,2,1,2,2,0,7,7
3544,Salinas 2022,2022,Dissertation,Ethnographic,1 United States,5 Not reported,2020,2 special education teacher,1,2 no,0,100,0,0,0,0,0,0,0,0,0,100,,20,,Resource room,3,3,3,Yes,Learning disability,Learning disability; Reading disability; Math disability; Autism spectrum disorder,2 Formally identified- IEP or diagnosis,1 Elementary (K-5),Reading,,,27,,required explanations to show understanding,9.03%,Learning Community Questions,"allowed students to help each other learn by 
building on each other's ideas",1.11%,Reverse Polarity Questions,expressed doubt of the accuracy of a student’s answer,9.42%,Two alternatives,"provided hints about the correct answer,",3.56%,Designedly Incomplete Utterances,"fill-in-the blank questions,",1.58%,Wh-questions,requested an explanation when the previous one was not acceptable,4.12%,Tag Questions,"statements that end with a word intended to reinforce or check 
something,",36.26%,,,,,,,Questioning,3 individual students (not pre-determined),41,30,9 weeks,4 Coded from human transcription of audio/video,1 Continuous,1 Event Sampling (Frequency),3 adapted from existing coding system,"Boelé (2016, 2017, 2018)",2 No,3 NA,,2 no,8 NA,0,1,1,2,0,0,4,4
3583,Cutter 2003,2003,Dissertation,Qualitative,1 United States,5 Not reported,2000,1 general education teacher,1,2 no,0,100,0,0,0,0,0,0,0,0,0,,,,,Small group,4,2,4,Yes,No primary,Learning disability; Developmental language disorder,2 Formally identified- IEP or diagnosis,1 Elementary (K-5),Science,,,59,,"disciplining, mitigating, topic management, coaching, offering choices, expressing a concern, entering the group, reviewing",30%,Metacognitive moves,"promoting student planfulness, providing a metascript, thinking outloud explicitly signaled, describing, pointing out similarities or differences in students' thinking, pointing out contradictions",Not reported,facilitating of students thinking,"brokering, calling for crystallization, checking status, responding neutrally encouraging to go on, revoicing, elaborating, summarizing, requesting students' thinking, scribing",Not reported,enculturation,"privilegeing, seeding, enculturate into ways of the scientific community, linking student language to scientific terminology, agreeing to disagree, refer to future investigation as means to verify claim to prediction, reinforce use of scientific terminology",Not reported,,,,,,,,,,,,,,,,Dialogic teaching; Explicit instruction; Behavioral feedback ; Metacognitive,2 target students (pre-determined),17,67,17 days,4 Coded from human transcription of audio/video,1 Continuous,1 Event Sampling (Frequency),1 researcher developed coding system,,2 No,3 NA,,2 no,8 NA,2,1,2,2,2,0,9,7
3591,Hallenbeck 1999,1999,Unpublished/Conference Paper,Quasi-experimental,1 United States,3 Rural,1990,2 special education teacher,1,2 no,100,0,0,0,0,0,0,0,0,0,0,100,,,,Resource room,4,4,4,No,Learning disability,Learning disability,2 Formally identified- IEP or diagnosis,2 Middle (6-8),Writing,,,55,,"guide a student who was
having difficulty to an entry point that would allow the writing process to move
forward as seamlessly as possible. teacher scaffolded with a balance of comments and questions that emphasized the concept of text structure and reader sensitivity
",309(count),,,,,,,,,,,,,,,,,,,,,,,,,Explicit instruction,1 whole group ; 2 target students (pre-determined),7,,4 months,4 Coded from human transcription of audio/video,1 Continuous,1 Event Sampling (Frequency),1 researcher developed coding system,,1 Yes,2 students,"Teachers modeled a cognitive strategy for writing, which emphasizes think-alouds and the thought processes of an experienced writer",1 yes,7 other academic,0,1,0,1,0,0,2,2
3602,McHam 1993,1993,Dissertation,Correlational,1 United States,5 Not reported,1990,1 general education teacher,48,2 no,20,79,0,58,31,10,0,0,0,0,0,0,,,,General education,,50,,No,Learning disability,Learning disability,2 Formally identified- IEP or diagnosis,1 Elementary (K-5); 2 Middle (6-8),Science; Social Studies,,,,,"discusses schoolwork or procedures with child individually, accepts child's initiation attempt, gives child response opportunity",Not reported,negative interactions,"criticizes child's academic work, gives behavioral criticism/reprimand/warning",Not reported,,,,,,,,,,,,,,,,,,,,,,Academic feedback ; Behavioral feedback ; Questioning; Logistical,2 target students (pre-determined),2,45,Not reported,1 Live observation and coding,1 Continuous,1 Event Sampling (Frequency),1 researcher developed coding system,,2 No,3 NA,,2 no,8 NA,2,1,2,1,2,1,9,7
3603,Bellaire 1992,1991,Dissertation,Correlational,3 Canada,1 Urban,1990,1 general education teacher,8,2 no,0,0,100,0,0,0,0,0,0,0,0,100,,14,,General education,233,16,29,No,Learning disability,Learning disability,"1 Not formally identified e.g. ""at-risk"" or ""struggling""; 2 Formally identified- IEP or diagnosis",1 Elementary (K-5),ELA; Math,,,40,,Statements that were punitive in nature,25.20%,Incidence of Interventions,All comments made to students,36.3/hr,,,,,,,,,,,,,,,,,,,,,,Behavioral feedback ; Teacher talk,1 whole group,4,12,Not reported,1 Live observation and coding,2 Intermittent,1 Event Sampling (Frequency),3 adapted from existing coding system,Intervention Strategy Record,2 No,3 NA,,1 yes,1 engagement/on-task behavior; 3 other emotional-behavioral; 4 reading; 5 math,0,1,1,0,0,0,2,2
3635,Given 1974,1974,Dissertation,Correlational,1 United States,4 Suburban,1970,2 special education teacher,5,2 no,0,100,0,0,0,0,0,0,0,0,0,100,37,7,,Alternative/Specialized,55,55,11,No,Learning disability,Learning disability,2 Formally identified- IEP or diagnosis,1 Elementary (K-5),Not reported,,,1,,"teacher lectures, gives directions, or criticizes or justifies their authority",.69/min,,,,,,,,,,,,,,,,,,,,,,,,,Dialogic teaching; Behavioral feedback ; Questioning; Instructional; Logistical; SEL,2 target students (pre-determined),8,25,2 weeks,2 Coding from video recording,1 Continuous,3 Interval,2 existing coding system (e.g. Brophy-Good Dyadic Interaction),"Flanders Interaction Analysis Categories System (Amidon & Flanders, 1967)",2 No,3 NA,,1 yes,2 challenging/disruptive behavior; 3 other emotional-behavioral; 4 reading; 5 math; 7 other academic,0,2,2,2,0,0,6,6
3664,Jossi 2015,2015,Dissertation,Descriptive,1 United States,5 Not reported,2010,1 general education teacher; 2 special education teacher,3,2 no,0,100,0,66,0,0,0,0,0,0,0,33,,6,,Inclusion,65,19,21,No,Learning disability,Learning disability,2 Formally identified- IEP or diagnosis,1 Elementary (K-5),Math,,,94,,"Teacher asks students to explain, give details or describe how the answer 
was reached when working with mathematical content",.07/min,higher order question- justify,"Teacher asks students to provide proof/evidence, to validate thoughts and 
ideas when working with mathematical content.",.00/min,higher order question- predict,"Teacher asks students to guess, predict, or make a hypothesis when working with mathematical content.",.01/min,higher order question- connect,"Teacher asks students to make connections between prior concepts 
taught to current topics, life experiences, or the world.",.01/min,,,,,,,,,,,,,,,,Questioning,1 whole group ; 3 individual students (not pre-determined),6,52,2 months,2 Coding from video recording,1 Continuous,1 Event Sampling (Frequency),1 researcher developed coding system,,2 No,3 NA,,1 yes,1 engagement/on-task behavior; 5 math,0,1,2,2,2,2,9,9
3688,Cameron 2004,2004,Dissertation,Descriptive,1 United States,1 Urban; 3 Rural; 4 Suburban,2000,1 general education teacher; 2 special education teacher; 3 paraprofessional/paraeducator/aide,17,2 no,17,82,0,100,0,0,0,0,0,0,0,0,,21,The official participants were the gen ed teachers but they collected observational data on special ed and paras when they were in the room during observations,Inclusion,367,13,21,No,No primary,Learning disability; Intellectual developmental disability; Emotional-behavioral disorder; Autism spectrum disorder,2 Formally identified- IEP or diagnosis,1 Elementary (K-5); 2 Middle (6-8),Not reported,,,,,"questions and 
statements that are the basis of direct instruction in independent and community living, self-care, recreation-leisure, or personal safety skills, praise or criticism in functional domains, or offers of assistance for performance in functional domains",Not reported,behavioral interactions,"any teacher interaction 
that refers directly to a student’s behavioral conduct",Not reported,social interactions,"questions or 
statements that are intended to directly instruct the student in social or communication 
skills or to encourage the student to communicate or socialize with others",Not reported,procedural interactions,"verbalization relating to everyday classroom management or routine activities that do not 
pertain to an individual student’s inappropriate or appropriate behavior",Not reported,whole group,interactions with the majority of students in the classroom,72.14%,small group,"exchanges with 2 or more students, but less than half of all students",5.96%,one-to-one,interactions that occurred solely between a teacher and an individual student,21.90%,,,,,,,Academic feedback ; Behavioral feedback ; Questioning; Instructional; Logistical,1 whole group ; 2 target students (pre-determined),5,,14 weeks,1 Live observation and coding,2 Intermittent,3 Interval,1 researcher developed coding system,Inclusive Classroom Observation System(ICOS),2 No,3 NA,,2 no,8 NA,2,2,1,2,2,1,10,8
3691,Pellegrin 2004,2004,Dissertation,Single-case design- MBL,1 United States,5 Not reported,2000,1 general education teacher,2,2 no,0,0,100,0,0,0,0,0,0,0,0,100,,,,General education,,5,,No,Attention deficit hyperactivity disorder,Attention deficit hyperactivity disorder,2 Formally identified- IEP or diagnosis,1 Elementary (K-5),Math,,,0,,"each time the teacher makes any statement to one of the target students that expresses approval, including but not limited to: “Nice job”, “That’s right!”, “Looks good”, “I like the way you wrote neatly/are trying hard”, and “You got them all right” spontaneously initiated by the 
teacher.",0% (true perc avg),Instructional feedback,"each time a teacher makes any statement to a target student relating to the academic assignment, 
answers a question(s) about academic items, or provides corrective feedback to the student about his or her work",6.25% (true perc avg),,,,,,,,,,,,,,,,,,,,,,Academic feedback ; Behavioral feedback,2 target students (pre-determined),33,10,Not reported,1 Live observation and coding,1 Continuous,3 Interval,1 researcher developed coding system,,1 Yes,2 students,recruiting teacher praise,1 yes,1 engagement/on-task behavior,0,2,2,2,2,2,10,10
3722,SCHWARTZ 1983,1983,Dissertation,Correlational,1 United States,5 Not reported,1980,2 special education teacher,8,2 no,37,62,0,0,0,0,0,0,0,0,0,100,,13,,Special education,63,63,7,No,No primary,Learning disability; Intellectual developmental disability; Emotional-behavioral disorder,2 Formally identified- IEP or diagnosis,1 Elementary (K-5); 2 Middle (6-8),Reading; Math,,,,,conversation with a student which has nothing to do with classroom work or classroom management,Not reported,behavioral contacts,teacher disciplines the child or makes individual comments concerning his classroom behavior,Not reported,,,,,,,,,,,,,,,,,,,,,,Dialogic teaching; Behavioral feedback ; Questioning; Teacher talk,2 target students (pre-determined),,,Not reported,1 Live observation and coding,1 Continuous,1 Event Sampling (Frequency),3 adapted from existing coding system,Teacher-Child Dyadic Interaction System for Coding,2 No,3 NA,,1 yes,4 reading; 5 math; 7 other academic,0,1,2,1,2,0,6,6
3738,Simmons 2023,2023,Dissertation,Qualitative,1 United States,4 Suburban,2020,1 general education teacher,1,2 no,0,100,0,0,0,0,0,0,0,0,0,100,,,,General education,16,4,16,No,No primary,Learning disability; Reading disability; Autism spectrum disorder; Attention deficit hyperactivity disorder,2 Formally identified- IEP or diagnosis,1 Elementary (K-5),Math,,,32,,To summarize or restate the information in a particular way,12.82%,Apply,The ability to use learned material in new and concrete situations,50%,Analyze,Understanding the underlying structure of knowledge to be able to distinguish between fact and opinion,3.85%,Evaluate,"Making judgments about the value of ideas, theories, items and materials",1.28%,Create,"Reorganizing concepts into new structures or patterns through generating, 
producing, or planning",0%,total questions asked,Not reported,47 freq,higher order questions asked,Not reported,28 freq,,,,,,,Questioning,3 individual students (not pre-determined),5,,6 weeks,1 Live observation and coding,1 Continuous,1 Event Sampling (Frequency),2 existing coding system (e.g. Brophy-Good Dyadic Interaction),Bloom's Revised Taxonomy,2 No,3 NA,,2 no,8 NA,0,1,0,1,0,0,2,2
3815,Anderson 1991,1991,Unpublished/Conference Paper,Randomized controlled trial,3 Canada,5 Not reported,1990,2 special education teacher,16,2 no,0,0,100,0,0,0,0,0,0,0,0,100,,,,Resource room,83,83,5,No,Reading disability,Learning disability,"1 Not formally identified e.g. ""at-risk"" or ""struggling""; 2 Formally identified- IEP or diagnosis",2 Middle (6-8); 3 High (9-12),Reading,,,,,"inform students, focus on text and learning about reading, set reading goals before reading, problem solve during reading, summarize to check comprehension, reflect on reading goals after reading, stress new learning content",Not reported,,,,,,,,,,,,,,,,,,,,,,,,,Explicit instruction; Questioning; Instructional; Metacognitive,1 whole group,1,30,1 day,4 Coded from human transcription of audio/video,1 Continuous,1 Event Sampling (Frequency),1 researcher developed coding system,,1 Yes,1 teachers,"Teaching shifts and self-evaluation, and principles and techniques for fostering active reading.",1 yes,1 engagement/on-task behavior; 4 reading,0,0,1,1,2,0,4,4
3838,Starling 2015,2015,Dissertation,Single-case design- MBL,1 United States,5 Not reported,2010,2 special education teacher,4,2 no,0,0,100,0,0,0,0,0,0,0,0,100,,,,Alternative/Specialized,25,25,6,No,Emotional-behavioral disorder,Emotional-behavioral disorder,2 Formally identified- IEP or diagnosis,1 Elementary (K-5); 2 Middle (6-8); 3 High (9-12),ELA; Math,,,0,,positive statements communicated verbally by the teacher to a student(s) that do not specify a desired student behavior,0.44/min,reprimands,negative feedback or statements communicated verbally by the teacher to a student.,0.003/min,,,,,,,,,,,,,,,,,,,,,,Academic feedback ; Behavioral feedback,1 whole group ; 2 target students (pre-determined),11,20,2 months,1 Live observation and coding,1 Continuous,1 Event Sampling (Frequency),1 researcher developed coding system,"(Hawkins & Heflin, 2011; Thompson et al., 2012)",1 Yes,1 teachers,video self-modeling to increase BSP,2 no,8 NA,0,2,2,2,2,1,9,9
3841,Young 2024,2024,Dissertation,Single-case design- ABAB,1 United States,5 Not reported,2020,1 general education teacher,2,2 no,0,100,0,100,0,0,0,0,0,0,0,0,,5,,General education; Inclusion,53,7,26,No,Emotional-behavioral disorder,Emotional-behavioral disorder,"1 Not formally identified e.g. ""at-risk"" or ""struggling""",3 High (9-12),ELA,,,5,,any statement made to a student intended to be corrective,.21/min,,,,,,,,,,,,,,,,,,,,,,,,,Behavioral feedback,1 whole group ; 3 individual students (not pre-determined),7,20,Not reported,1 Live observation and coding,1 Continuous,1 Event Sampling (Frequency),1 researcher developed coding system,,1 Yes,1 teachers; 2 students,CW-FIT,1 yes,1 engagement/on-task behavior; 7 other academic,2,2,2,2,2,2,12,10
3851,Hackett 2023,2023,Dissertation,Single-case design- MBL,1 United States,5 Not reported,2020,1 general education teacher; 2 special education teacher,3,2 no,0,100,0,100,0,0,0,0,0,0,0,0,,4,,General education; Small group,35,5,11,No,Attention deficit hyperactivity disorder,Attention deficit hyperactivity disorder,2 Formally identified- IEP or diagnosis,1 Elementary (K-5),Not reported,,,34,,"a verbal praise statement 
from a teacher to a student that is specifically about their behavior",.16/min,,,,,,,,,,,,,,,,,,,,,,,,,Behavioral feedback,1 whole group ; 3 individual students (not pre-determined),6,20,Not reported,1 Live observation and coding,1 Continuous,1 Event Sampling (Frequency),1 researcher developed coding system,,1 Yes,1 teachers,focused on improving rates of behavior specific praise and general praise through teacher consultation/education,2 no,8 NA,2,2,0,2,2,1,9,7
3867,Hall 2019,2019,Dissertation,Single-case design- MBL,1 United States,3 Rural,2010,1 general education teacher,3,2 no,0,100,0,0,0,0,0,0,0,0,0,100,,8,,General education,59,11,19,No,No primary,Learning disability; Intellectual developmental disability; Autism spectrum disorder,2 Formally identified- IEP or diagnosis,1 Elementary (K-5),Not reported,,,27,,a general positive statement delivered to an individual or group,32.67% (avg of perc),negative comments,"connotes a lack of positive qualities or productiveness including sarcasm, or tone of voice including criticism and demeaning remarks directed to an individual or group",40.33% (avg of perc),verbal prompting,"prompt is a verbal statement given 
to learners either prior to a specific response following an instruction or after an error has 
occurred",46.67%,,,,,,,,,,,,,,,,,,,Behavioral feedback,1 whole group ; 3 individual students (not pre-determined),5,20,Not reported,2 Coding from video recording,1 Continuous,1 Event Sampling (Frequency),1 researcher developed coding system,,1 Yes,1 teachers,"increasing praise, prompting and decreasing negative comments",2 no,8 NA,0,2,1,2,2,1,8,8
3873,Reed 2014,2014,Dissertation,Single-case design- MBL,1 United States,5 Not reported,2010,2 special education teacher,1,1 yes,0,0,100,0,0,0,0,0,0,0,0,100,,,,Small group,3,3,3,Yes,Emotional-behavioral disorder,Reading disability; Emotional-behavioral disorder,"1 Not formally identified e.g. ""at-risk"" or ""struggling""; 2 Formally identified- IEP or diagnosis",1 Elementary (K-5),Reading,,,0,,,,,,,,,,,,,,,,,,,,,,,,,,,,Behavioral feedback,3 individual students (not pre-determined),7,,Not reported,1 Live observation and coding,1 Continuous,1 Event Sampling (Frequency),1 researcher developed coding system,,1 Yes,1 teachers,the use of behavior specific praise,1 yes,1 engagement/on-task behavior,0,2,1,2,2,2,9,9
3981,Pacitto 2019,2019,Dissertation,Descriptive,1 United States,1 Urban,2010,1 general education teacher; 2 special education teacher,3,2 no,0,100,0,0,0,0,0,0,0,0,0,100,,,,General education; Special education,,3,,No,No primary,Emotional-behavioral disorder; Autism spectrum disorder; Attention deficit hyperactivity disorder,2 Formally identified- IEP or diagnosis,1 Elementary (K-5),Academics,,,58,,"positive statements directed at one or more students which indicate a specific behavior and delivered in a monotone voice with low fluctuation, pitch, and volume",17.2%(avg. of %),general praise enthusiastic,positive statements directed at one or more students which do not indicate a specific behavior and delivered with high pitch and volume,18.17%(avg. of %),"behavior specific praise enthusiastic
",positive statements directed at one or more students which indicate a specific behavior and delivered with high pitch and volume,6.25% (avg. of %),praise,,1.02/min(avg. of %),,,,,,,,,,,,,,,,Behavioral feedback,1 whole group ; 3 individual students (not pre-determined),4,,Not reported,1 Live observation and coding,1 Continuous,1 Event Sampling (Frequency),1 researcher developed coding system,,2 No,3 NA,,2 no,8 NA,0,1,0,2,2,2,7,7
3995,McKenzie 2016,2016,Dissertation,Single-case design- MBL,1 United States,5 Not reported,2010,2 special education teacher,3,1 yes,0,100,0,100,0,0,0,0,0,0,0,0,,11,teacher were suggested by principals for needed support with classroom management,Special education,10,3,3,Yes,Emotional-behavioral disorder,Emotional-behavioral disorder,"1 Not formally identified e.g. ""at-risk"" or ""struggling""",1 Elementary (K-5),Reading; Math,,,1,,"Teacher provides specific feedback to the student or group of students 
regarding the behavior that is being approved",.07/min,Behavior Specific Praise-target student,"Teacher provides specific feedback to the student or group of students 
regarding the behavior that is being approved",.09/min,General Praise- group,Teacher provides no specific feedback about the behavior being approved,.06/min,General Praise- individual,"Teacher provides no specific feedback about the behavior 
being approved",.08/min,General Praise- target student,"Teacher provides no specific feedback about the behavior 
being approved",.12/min,Reprimand- group,teacher provides a correction or reprimand statement that is intended to correct a specific academic or social behavior,.002/min,Reprimand- individual,teacher provides a correction or reprimand statement that is intended to correct a specific academic or social behavior,.02/min,Reprimand- target student,teacher provides a correction or reprimand statement that is intended to correct a specific academic or social behavior,.08/min,,,,Academic feedback ; Behavioral feedback,1 whole group ; 3 individual students (not pre-determined),6,20,Not reported,1 Live observation and coding,1 Continuous,1 Event Sampling (Frequency),1 researcher developed coding system,,1 Yes,1 teachers,"teacher coaching and performance feedback with classroom assessment focused on praise, reprimands, and opportunities to respond",1 yes,2 challenging/disruptive behavior,2,2,2,2,2,1,11,9
